"Task Name","Description","Priority","Phase","Tags"
"Implement User Authentication","Allow users to create accounts, log in, and manage profiles securely.","High","Development","Development"
"Build Product Catalog","Display products with high-resolution images, descriptions, prices, and variants (size, color).","High","Development","Development"
"Develop Shopping Cart","Enable users to add products, view cart, and proceed to checkout with persistence (saves cart if logged out).","High","Development","Development"
"Create Checkout Process","Implement a secure checkout with payment gateways (e.g., Stripe (https://stripe.com), PayPal (https://www.paypal.com)), shipping address selection, and order confirmation. Include a promo code field.","High","Development","Development"
"Set Up Order Management","Allow users to track orders, view order history, and manage returns/exchanges.","Medium","Development","Development"
"Implement Search and Filtering","Enable advanced search with autocomplete, spell correction, and filters for categories, sizes, colors, and prices.","Medium","Development","Development"
"Add Wishlist Feature","Let users save products for later purchase.","Medium","Development","Development"
"Integrate Reviews and Ratings","Allow users to leave feedback and rate products to build trust and improve SEO.","Medium","Development","Development"
"Set Up Promotions and Discounts","Support promo codes, discounts, and loyalty programs.","Medium","Development","Development"
"Implement Personalization","Recommend products based on browsing history or preferences using AI-driven algorithms.","High","Development","Development"
"Ensure Mobile Optimization","Make the platform fully responsive across all devices, prioritizing mobile-first design.","High","Development","Development"
"Integrate Social Media","Allow product sharing and social logins (e.g., via Instagram (https://www.instagram.com), X (https://x.com)).","Medium","Development","Development"
"Create Content Section","Add a blog for fashion tips, brand stories, or product features to engage users.","Low","Development","Development"
"Set Up Live Chat/AI Assistant","Provide real-time customer support through live chat or an AI chatbot.","Medium","Development","Development"
"Implement Multi-language/Currency Support","Cater to international customers by supporting multiple languages and currencies.","Medium","Development","Development"
"Set Up Inventory Management","Implement real-time stock updates to prevent overselling.","High","Development","Development"
"Integrate Analytics/Reporting","Track sales, user behavior, and metrics using tools like Google Analytics (https://analytics.google.com).","High","Development","Development"
"Add Promo Code Functionality","Include a field in the checkout form for promo codes, validate codes, and apply discounts (e.g., percentage off, free shipping).","High","Development","Development"
"Implement Product Variants","Support sizes, colors, and styles for clothing products.","High","Development","Development"
"Add Image Galleries","Include multiple high-resolution images with zoom and 360-degree views for better product visualization.","High","Development","Development"
"Provide Size Charts","Offer detailed size guides on product pages to reduce returns.","High","Development","Development"
"Offer Multiple Shipping Options","Provide various shipping methods with estimated delivery times.","High","Development","Development"
"Automate Tax Calculation","Calculate taxes based on the shipping address for accurate pricing.","High","Development","Development"
"Add Gift Wrapping/Personalization Options","Allow gift wrapping or custom embroidery for a premium touch.","Medium","Development","Development"
"Set Up Abandoned Cart Recovery","Send reminder emails with discounts to recover lost sales.","High","Development","Development"
"Implement Email Notifications","Send order confirmations, shipping updates, and delivery notices.","High","Development","Development"
"Enable Wishlist Sharing","Allow users to share wishlists via email or social media.","Low","Development","Development"
"Set Up Account Recovery","Offer password reset options for user convenience.","High","Development","Development"
"Optimize Performance","Implement image optimization, caching, and choose a high-performance hosting provider (e.g., Kinsta (https://kinsta.com)).","High","Development","Development"
"Ensure Security","Use SSL/TLS encryption, ensure PCI DSS compliance, and conduct regular security audits.","High","Development","Development"
"Set Up Integrations","Connect with shipping carriers, email marketing tools (e.g., Omnisend (https://www.omnisend.com)), and analytics platforms.","High","Development","Development"
